<!DOCTYPE ksiazka SYSTEM "ksiazka.dtd">
<ksiazka>
        <tytul_ksiazki>Eona. Ostatni lord Smocze Oko.</tytul_ksiazki>
        <autor imie="Alison" nazwisko="Goodman">
                
        </autor>
        <wprowadzenie>Tutaj jest tekst wprowadzenia</wprowadzenie>
        <rozdzial>
                <tytul_rozdzialu>A tutaj jest tytuł rozdziału</tytul_rozdzialu>
                <nr_strony>Oraz Sterona</nr_strony>
                <sekcja>
                        <tytul_sekcji>Hiszpania</tytul_sekcji>
                        <akapit></akapit>
                </sekcja>
        </rozdzial>
        
        <rozdzial>
                <tytul_rozdzialu>Kolejny rozdział</tytul_rozdzialu>
                <nr_strony>I kolejna strona</nr_strony>
                <sekcja>
                        <tytul_sekcji>Plaza</tytul_sekcji>
                        <akapit>Coś co znajduje się w danej sekcji</akapit>
                        <akapit>I znowu coś co znajduje się w sekcji</akapit>
                </sekcja>
        </rozdzial>
</ksiazka>
